{
  "schema_version": "1.0.0",
  "environment_class": "test",
  "remote_url": "https://github.com/inforvans/accord.git",
  "remote_ref": "refs/heads/foundation-task-1",
  "remote_sha": "aaaaaaaaaaaaaaaaaaaaaaaaaaaaaaaaaaaaaaaa",
  "remote_tree_sha": "bbbbbbbbbbbbbbbbbbbbbbbbbbbbbbbbbbbbbbbb",
  "images": {
    "control-api": {
      "repository": "ghcr.io/inforvans/accord-control-api",
      "digest": "sha256:1111111111111111111111111111111111111111111111111111111111111111"
    },
    "control-worker": {
      "repository": "ghcr.io/inforvans/accord-control-worker",
      "digest": "sha256:2222222222222222222222222222222222222222222222222222222222222222"
    },
    "webhook-edge": {
      "repository": "ghcr.io/inforvans/accord-webhook-edge",
      "digest": "sha256:3333333333333333333333333333333333333333333333333333333333333333"
    }
  },
  "release_manifest_digest": "sha256:cccccccccccccccccccccccccccccccccccccccccccccccccccccccccccccccc",
  "dsse_envelope_digest": "sha256:dddddddddddddddddddddddddddddddddddddddddddddddddddddddddddddddd",
  "verification_receipt_digest": "sha256:eeeeeeeeeeeeeeeeeeeeeeeeeeeeeeeeeeeeeeeeeeeeeeeeeeeeeeeeeeeeeeee",
  "signature_verified": false,
  "scan_policy_passed": false,
  "created_at": "2026-07-27T00:00:00Z"
}
